cid,name,mythology,birthday,birthday_unlock,height,height_unlock,body_shape,body_shape_unlock,mbti,mbti_unlock,tendency,tendency_unlock,personality,personality_unlock,personality_word,personality_word_unlock,preferences,preferences_unlock,ideal_type,ideal_type_unlock,vow_word
2052,Michael,Hebrew Gods,9-27,500,166cm,1000,B98·W59·H91,1000,INTJ - The Architect,200,Order - Selfless,500,"Brave, calm, few words",500,"War is the quickest way to eliminate evil, but it sadly sows the seeds of new evil.",3000,"Reading, confession, religious studies, sword fighting",1500,"A person who upholds justice, never questions, and firmly obeys orders",1500,"I am accustomed to the loneliness imposed by justice. I am grateful for the kindness you bring to my life. Perhaps, I made a good choice with you."
2053,Himiko,Japanese Gods,11-14,500,168cm,1000,B100·W60·H94,1000,ISTJ - The Logistician,200,Order - Neutral,500,"Short-spoken, persistent, firm",500,I see little distinction between gods and mortals. Gods are just more powerful versions of humans.,3000,"Collecting famous swords, drinking, sword fights, baths, and poetry",1500,"A person who is brave, upright and have military spirit.",1500,"I recognize your courage. Despite your youth, you are the only person brave enough to make an eternal vow with me. In the years ahead, I will happily share my experience as a ruler with you."
2054,Enmusubi,Japanese Gods,6-2,500,162cm,1000,B100·W58·H91,1000,ENFJ - The Protagonist,200,Order - Selfless,500,"Cheerful, humorous, gentle",500,"That's terrible...it seems like you have contracted a disease called lovesickness, and there's no cure for it!",3000,"Flying yarn, fortune-telling, baking desserts, and participating in grand festivals",1500,The person who is connected to me by the thread of fate,1500,You are so sly! You never hinted that you might want to make a vow with me. All this time I misunderstood your intentions. I'm so bad at these things.
2055,Frost Dragon,Special Gods,4-14,500,170cm,1000,B105·W61·H95,1000,ISFJ - The Defender,200,Neutral - Neutral,500,"Calm, elegant, gentle",500,"I thought about facing the end of this world alone, until you showed me a glimmer of hope...",3000,"Treasure collecting, architecture, entertaining children, ice skating, dancing",1500,"Someone who is responsible for the family, gentle and considerate, and looks protective at first glance",1500,"I used to think that having a cold, hard heart made me stronger. But you helped me see the true strength of a mutual and unbreakable bond."
2056,Ember Dragon,Special Gods,5-9,500,169cm,1000,B102·W60·H93,1000,ENFJ - The Protagonist,200,Chaos - Neutral,500,"Reckless, courageous, determined",500,"The reason why God is called God is not because of his great power, but because of his extraordinary courage and determination to die!",3000,"Sauna, treasure collection, travel, fighting",1500,A man who dared to challenge the gods,1500,"Does this vow mean we will be together for our entire lives? That's wonderful, but... I hope you like eating barbecue for every meal."
2057,Storm Dragon,Special Gods,4-22,500,168cm,1000,B101·W59·H94,1000,ISTJ - The Logistician,200,Order - Neutral,500,"Intelligent, steady, artistic",500,I understand that this calm and warm power is the result of your continued trust in me.,3000,"Antique collecting, chess, poetry, reading, observing nature, studying human beings",1500,"A person who is rational, intelligent, easy-going, and can be the object of his own human study and observation",1500,"You humans really do make a ritual of marriage. After observing you for so long, I've found that I have feelings for you that are difficult to analyze rationally."
2058,Nekomata,Japanese Gods,6-13,500,156cm,1000,B89·W57·H87,1000,ENFP - The Campaigner,200,Chaos - Selfless,500,"Lively, innocent, optimistic",500,"Huh... I smelled something I like! You brought some dried fish, right?",3000,"Make snacks, catch butterflies, take a nap, play pranks",1500,"Someone who feeds me dried fish, takes me shopping, and allows me to doze off on his lap",1500,"An eternal vow to bind our souls? *meow* What is that? Is it edible? If I accept, will there be plenty of dried fish? *meow* But you are so kind and gentle, I believe what you do is good for me. *meow* "
2059,Zodiac Ox,Special Gods,1-14,500,163cm,1000,B100·W59·H91,1000,ENFP - The Campaigner,200,Order - Neutral,500,"Reckless, determined, willful",500,Do you know? Not all of my companions are as good at fighting as I am...,3000,"Martial arts, wrestling, boxing",1500,Someone who can take a punch from himself without falling down,1500,"Once we make this vow to each other, will I never be able to return to my own world? Hmm... We have gotten along well together. I probably wouldn't mind staying here in your world with you."
2060,Freyja,Norse Gods,8-30,500,165cm,1000,B98·W58·H91,1000,INTP - The Logician,200,Neutral - Neutral,500,"Gentle, intelligent, elegant",500,Love is the most mysterious thing in the world. Many wars begin and end with it.,3000,"Divination, astrology, medical research, magic research, pastry baking, chess",1500,Someone who can guess the result of a divination by luck alone without using magic,1500,My vow with you is also a kind of magic which only the sacred power of love and trust can activate. Do you understand?
2061,Kingyo,Japanese Gods,3-11,500,160cm,1000,B98·W60·H92,1000,ISFP - The Explorer,200,Chaos - Selfless,500,"Optimistic, artistic, innocent",500,"When I transformed into a human form, I was quite worried whether I would be too fat!",3000,"Swimming, sunbathing, and participating in grand festivals",1500,Someone who can accompany me to various festivals and ceremonies every day,1500,"I'm shocked that you were willing to make a sacred vow with me, an ordinary monster. May the Yamato gods bless us with happiness and protect our souls."
2062,Princess Kaguya,Japanese Gods,9-15,500,158cm,1000,B92·W58·H89,1000,INFP - The Mediator,200,Neutrality - Selfless,500,"Literary, taciturn, innocent",500,"I will miss the time I spent with you admiring the moon, and I hope you won’t forget the promise we made to each other…",3000,"Playing chess, poetry, playing bamboo flute, and watching the moon",1500,A man who has the ability to take himself back to the moon,1500,"The moonlight is really beautiful tonight, isn't it? Exchanging vows with you on the night of a full moon is a blessing that will always be worth remembering."
2063,Sim Cheong,Korean Gods,10-14,500,164cm,1000,B100·W58·H93,1000,ISFJ - The Defender,200,Chaos - Selfless,500,"Short-spoken, gentle, firm",500,"Regardless of the time, one’s own kin will always be the most cherished presence.",3000,"Cooking, medical research, plant cultivation, reading, traveling",1500,A person who has a sense of responsibility and can put the general righteousness and close relatives first.,1500,"Even before this vow, you were like family to me. I am very grateful for this eternal bond between us. May the Goddess of Water protect you, the most important member of my family."
2065,Gemini,Special Gods,5-21,500,162cm,1000,B101·W58·H93,1000,？？？,200,？？？,500,？？？,500,"The world you live in, perhaps it’s just an illusion in the mirror......",3000,？？？,1500,A person who understands and accepts her two personalities.,1500,"Whenever I've thought of making a vow to you, the other me could sense those private thoughts. I blush when I think she knows how I feel about you."
2067,Chang'e,Chinese Gods,8-15,500,162cm,1000,B100·W58·H94,1000,ESFP - The Entertainer,200,Chaos - Selfless,500,"Lively, optimistic, humorous",500,Why?! Huh? So humans were actually capable of reaching the moon decades ago?,3000,"Moon viewing, dim sum baking, music, dancing, reading, and raising small animals",1500,"A person who can catch her pet, Jade Hare, with bare hands.",1500,"You like rabbits, too!? Then you must be a good person. That's reason enough for me to make this vow with you!"
2068,Asura,Special Gods,6-24,500,170cm,1000,B102·W59·H92,1000,ENFJ - The Protagonist,200,Chaos - Solipsistic,500,"Straightforward, brave, reckless",500,"There are quite a lot of strong people in this world, and having a few exciting fights with them is a good way to kill time.",3000,"Sword fighting, martial arts, adventure, looking for strong people to duel",1500,Someone who can beat her in a one-on-one duel,1500,"I never imagined that my dream would come true. Of course, I will make a vow with you! From now on, I promise to protect you... and cook you amazingly delicious food."
2069,Athena,Greek Gods,9-1,500,168cm,1000,B102·W60·H95,1000,ENTP - The Debater,200,Neutrality - Selfless,500,"Determined, intelligent, brave",500,"Courage is born from wisdom, strength is guided by courage, the battlefield is swept by strength, and glory is achieved on the battlefield!",3000,"Chess, history, weapons collecting, sword fighting, art appreciation",1500,A person who can beat himself three games in a row at chess,1500,Our vow unites us. Allow my wisdom and strength to help you find the courage to face your enemies and defeat them in battle.
2070,Zodiac Tiger,Special Gods,7-17,500,164cm,1000,B95·W58·H89,1000,ENFP - The Campaigner,200,Chaos - Neutral,500,"Determined, reckless, lively",500,"There are quite a lot of strong people in this world, and having a few exciting fights with them is a good way to kill time.",3000,"Martial arts, fighting, eating contests",1500,"A strong, confident, straightforward person who can fight with himself every day",1500,Uh... What a hassle! It's better to fight against rivals rather than make vows!
2071,Capricornus,Special Gods,12-25,500,174cm,1000,B101·W59·H95,1000,INFP - The Mediator,200,Chaos - Selfless,500,"Selfish, literary, elegant",500,This awakened power will become the key to guiding the fate of the gods and world peace!,3000,"Opera, music, swimming, reading, writing fairy tales",1500,Someone like the Prince Charming in fairy tales,1500,"A vow is a kind of sacrifice, which means that from now on, we will live by one faith. I hope that our powers combine so that we can create a world worth fighting for."
2073,Pisces,Special Gods,3-22,500,164cm,1000,B99·W59·H94,1000,ESFP - The Entertainer,200,Chaos - Neutral,500,"Artistic, innocent, lively",500,Our journey is to the sea of stars!!,3000,"Watching musicals, fashion design, swimming, fortune-telling, sailing trips",1500,Someone who is adventurous and willing to travel around the world with me,1500,Eh?! This contract can prove our relationships. Let me see what’s on it...Uh...what a hassle! It’s difficult to understand the ancient script.
2074,Venus,Greek Gods,3-22,500,167cm,1000,B108·W60·H95,1000,INFP - The Mediator,200,Neutrality - Solipsistic,500,"Artistic, gentle, elegant",500,"The only difference between love and war is...there are never winners in war, but there are never losers in love.",3000,"Fashion design, antique and jewelry collecting, reading, sculpture, opera",1500,The most beautiful person in the world,1500,"When we made this vow, our minds mingled, and I could read your thoughts. Have you always had such wild and daring desires for me, my dear?"
2075,Zeus,Greek Gods,1-1,500,167cm,1000,B103·W60·H92,1000,ESTJ - The Executive,200,Neutrality - Solipsistic,500,"Humor, courage, selfishness",500,"In my opinion, war is just a pastime between the strong!",3000,"Love, adventure, drinking, traveling, and throwing big parties",1500,"Someone with a distinguished background, a long-term vision, wisdom, and someone who is willing to work with me",1500,You are the first person in ages to be worthy of making a vow with me.
2076,Loki,Norse Gods,4-1,500,165cm,1000,B104·W61·H96,1000,ENFP - The Campaigner,200,Chaos - Solipsistic,500,"Humor, optimism, changeability",500,"Don't worry, dear, we still have plenty of time tonight...",3000,"Pranks, entertaining children, opera, music, studying magic",1500,The one who successfully deceived her with lies and tricks,1500,"I enjoy making everyone fall under my charm, but I never imagined that I would fall under yours. You are full of surprises!"
2077,Thor,Norse Gods,11-25,500,166cm,1000,B102·W60·H92,1000,ESFP - The Entertainer,200,Neutrality - Solipsistic,500,"Humor, domineering, optimistic",500,Capture people's hearts with charm and drive away darkness with strength.,3000,"Drinking, attending grand banquets, sword fighting",1500,Someone who can fight alongside her and protect Asgard until Ragnarok comes.,1500,"In the presence of others, I demonstrate only my mighty power. But only before you will I show my gentleness. I hope we can join hands and bring peace to this world!"
2078,Apollo,Greek Gods,8-5,500,168cm,1000,B99·W59·H91,1000,INFJ - The Advocate,200,Order - Solipsistic,500,"Artistic, brave, straightforward",500,"There are not many mortals who dare to look me in the eye, but none of them are strangers to the light.",3000,"Music, dance, opera, painting, treasure collecting, flower cultivation",1500,The man who could create the greatest work of art,1500,"I once hoped that my radiance could shine up everyone. But now that we have made this vow, my glowing light will belong to you alone."
2079,Sakura Spirit,Japanese Gods,3-3,500,159cm,1000,B97·W58·H90,1000,INFP - The Mediator,200,Neutral - Neutral,500,"Artistic, innocent, gentle",500,Spring is the happiest season of the year because there is nothing more beautiful than the cherry blossoms scattering in the spring breeze.,3000,"Dancing, brewing, music, flower planting, participating in grand festivals",1500,"A pure, kind, versatile person without any ulterior motives",1500,"This day finally come. I am so happy! From now on, I will only bloom for you till the end of my life."
2080,Zodiac Rabbit,Special Gods,7-7,500,160cm,1000,B94·W58·H91,1000,ESFP - The Entertainer,200,Chaos - Selfless,500,"Humor, gentleness, liveliness",500,Ah! It's another sunny day. Take me for a walk. Maybe I can dig some carrots on the way.,3000,"Sports, crafts, cooking, pastry baking",1500,A man with a huge carrot farm,1500,Are you the human who wish to vow to me? I will accompanied by your side from now on. Remember to come and see me if you got the time!
2081,Horus,Egyptian Gods,8-17,500,167cm,1000,B100·W59·H91,1000,INTP - The Logician,200,Order - Neutral,500,"Firm, steady, gentle",500,"Looking into the distance, at the end that is beyond the reach of the eyes, may be the place where fate cannot control.",3000,"Reading, bathing, history, raising small animals",1500,"A person who is honest, seeks truth, and has the courage to accept his fate",1500,"I used to believe that no one in this world could make my heart flutter, until I met you."
2082,Frigga,Norse Gods,11-17,500,164cm,1000,B103·W59·H94,1000,ISFJ - The Defender,200,Chaos - Solipsistic,500,"Capricious, selfish, willful",500,The pain brought by thorns is also an unforgettable enjoyment...,3000,"Flower cultivation, opera, reading, dance, architecture",1500,Someone who is crazy about opera art and can write excellent scripts,1500,I plucked all the flowers from the rose garden to make a path for you… I hope you will love everything here…
2083,Ares,Greek Gods,4-23,500,169cm,1000,B101·W58·H91,1000,ENFJ - The Protagonist,200,Chaos - Solipsistic,500,"Reckless, brave, straightforward",500,"When facing a battlefield, the weak always have reasons to escape, while the strong have no fear at all!",3000,"Weapon and armor collection, sword fighting, challenge the gods",1500,The first person to conquer the divine world,1500,"Hmm… I know there are countless people who covet you, but you are a rare prize that no one can take away from me."
2084,Uriel,Hebrew Gods,4-30,500,164cm,1000,B101·W60·H96,1000,ESFP - The Entertainer,200,Order - Solipsistic,500,"Literary, humorous, gentle",500,Do you like my dancing? Maybe I can do a little... more daring dance just for you.,3000,"Dancing, drinking, and throwing big feasts",1500,A person who can keep up with her dance moves and is willing to be her dance partner.,1500,"I await the moment to step onto the stage with you, anticipating the time when demons, angels, and humans will cheer for us together. You once brought me freedom, and I shall be your eternal partner."
2085,Zodiac Dragon,Special Gods,7-12,500,161cm,1000,B93·W59·H90,1000,ENTP - The Debater,200,Neutrality - Selfless,500,"Lively, innocent, smart",500,Huh...it's time to rain again! How about I make a few loud thunders to liven up the atmosphere?,3000,"Astrology, divination, reading, dancing",1500,People who are not afraid of thunder,1500,"Engrave your name on this Dragon Ball, the sacred symbol of our pact! As per the ancient tradition of the Eastern Dragon lineage, our souls shall unite as one!"
2086,Hela,Norse Gods,12-21,500,169cm,1000,B101·W59·H96,1000,ISTJ - The Logistician,200,Order - Neutral,500,"Intelligent, calm, humorous",500,Your... seems to be smarter than I thought. Are you interested in accepting eternity with me?,3000,"Human studies, magic studies, astrology, history, handicrafts",1500,Someone who is willing to give up everything in order to explore the truth.,1500,"In the name of the Lord of the Dead, I am willing to reach your soul, to forge an eternal pact, to cross the curtains of life and death, and to reach the distant shore on the other side..."
2087,Prometheus,Greek Gods,2-1,500,168cm,1000,B100·W59·H93,1000,ENFP - The Campaigner,200,Chaos - Selfless,500,"Humorous, gentle, and upright",500,"Heh, if borrowing a little fire was enough to anger Zeus, I wonder what would happen if I returned with some thunder and lightning.",3000,"Enjoys treasure collecting, cooking, traveling, fortune telling, astrology, and studying humans",1500,Willing to sacrifice themselves to uphold their ideals of righteousness,1500,"You unlocked the prison where the gods had confined me, yet I willingly placed the chains of bondage upon myself for you. Fate truly is an inexplicable force..."
