idx,cid,state,girl_dialog,switch_1,switch_2,girl_dialog_after_switch1,girl_dialog_after_switch2,sound,sound_after_switch1,sound_after_switch2,award,favorability
73,2031,1,Are you interested in judging the dead with me?,Yes!,It seems a little scary...,"You made a sensible choice! When you go on my trial after you die, I promise you will know more...","Don't worry, it's much more fun than you think...especially when you kick the nasty guy down the abyss...",,,,,10
74,2031,2,War is meaningless. Destiny will not be changed just by a war...,War is only a method.,"But in fact, it's not.",I don't feel repulsion for war. The dead people caused by war can make my lonely palace bustling for months...,"Well, let's make a bet and see if this doomsday can end with the war you lead.",,,,,10
75,2031,5,"As a mortal, what do you think of me as a god of death?",Super handsome and charming!,A bit scary……,"Uh-hum, are you free tonight? Are you interested in experiencing the charming side of the god of death in my room?",It really disappoints me. It seems that I need to punish you tonight who doesn't understand the romance...,,,,,10
76,2025,2,"War is an act of harming nature, and I will prevent it at any time.",Nature also has a temper.,I agree with you.,"Nature does sometimes bring disasters, but this is a destiny directed by heaven, not a man-made disaster.","Although you often fight on the battlefield, I know that everything you do is to end the war as soon as possible.",,,,,10
77,2025,2,"It often takes several years to repair the cracks in the heavens, which needs to be patient...",I am impatient sometimes.,I am always patient!,I hope you don't get too impatient when you get along with girls. Girls get angry even more terrible than the heaven cracks...,"Oh, is it? Then you must be very good at chasing girls. It takes a lot of patience to get along with girls...",,,,,10
78,2025,2,Conforming to nature is the most reasonable behavior. Everything and every rule in the world are originated from nature.,Let nature take its course.,People should control nature.,"I am very pleased that you can agree. Everything has a destiny, and nature controls them all the time.","I certainly don't think other people can succeed, but if it is you... maybe there is a small possibility.",,,,,10
79,2025,1,"Although I have lost part of my divine power, I don't regret it. It's just that nature needs me to return the power to it.",Do you want to regain your divine power?,I will always guard you!,"I appreciate your kindness, but there is no need to do so, because this is the destiny that nature wants me to face.",Haha... No mortal has ever said something like this to me...Do you know what it means?,,,,,10
80,2025,1,Do you ask me about my hobbies? I think I like raising cute animals and growing flowers.,It seems a little flat...,Very elegant interest!,"Believe me, after experiencing countless adventures and excitement, you will feel that dull life is a kind of enjoyment.",Do you think so too?! Would you be interested in coming to my garden tonight to see the potted plants I plant?,,,,,10
81,2052,2,"Even if I am the only one left in the world, I will fight for justice to the last second!",I will be always at your side.,Hope you can grant me courage.,"Humph... Hope you can really have this consciousness. After all, justice requires extraordinary courage.","Courage comes from your consciousness. When your consciousness is unassailable, nothing can stop you on the battlefield.",,,,,10
82,2052,1,"Do you want to know heaven? It seems to be nothing special for me, but at least there won't be any evil.",Hope to go there and have a look.,What about hell?,"I can send you to heaven right now, but there is no return. Do you want to have a try?","I don't know, but judging from the screams from the sulfur fiery pits of hell every day, it should be a very exciting place.",,,,,10
83,2052,2,"War is the fastest way to destroy evil, but not the best way...",Why do you say that?,What is the best way?,Do you think it is really the devil who destroys this world? Or it is the evil thoughts hidden in the hearts of people or gods?,"I don't know either, but I'd rather say that I hope you can solve this problem one day.",,,,,10
84,2052,1,Lucifer... I am looking forward to what you will do with this evil and crafty guy after we catch her.,I'll persuade her to work for me.,What do you think I should do?,"Are you kidding me? ! If it is true, I must give you a few punches to confirm that you are not dreaming!","I would be happy to find a choir to sing hymns to her every day for hundreds of years, until she can't stand then pleads guilty and repents.",,,,,10
85,2052,2,"As the leader of the gods, you are still too young. In many cases, you lack the rationality to handle things like I do.",The rationality to handle things?,(Hug Michael),"As a commander of the gods, courage and rationality are all needed, but rationality is the prerequisite for all correct judgments!",What... what are you going to do? ! The people around us.. They are watching us! I'm going to be angry if you don't let go!,,,,,10
86,2016,2,I was born for war and the eternal glory found only through victory on the battlefield!,Wish you good luck in the war.,Glory is paramount!,"So, when is the next battle? I am looking forward to fighting against powerful enemies.",We will achieve glory in the name of Valhalla! I hope that we can be invincible under your command!,,,,,10
87,2016,3,You want to know what weapons I fight best with? I'm good with all weapons!,That's amazing!,Can you teach me that?,"Because my body harbors the souls of many Valkyries, I can use all of their combat techniques.","No problem! With your aptitude and perception, you can easily master all of these skills!",,,,,10
88,2016,5,"I am never alone, for my body harbors the souls of all the Valkyries that came before me.",Can you teach me?,Are they aligned with our goals?,"I don't know, but I felt all of my sisters resonating when I arrived in response to your summons.","Of course we do. But when we disagree, I stop to meditate. Then, within my mind, we battle each other. When it is over, all of us listen to the winner.",,,,,10
89,2016,1,"Ah, sorry, I was a bit distracted just now. In fact, I was thinking about your battle tactics.",Don't you quarrel?,Is there a better strategy?,"Valkyries are excellent warriors, but unfortunately we are poor military advisors.","Based on our previous victories, your battle tactics have proven to be sound.",,,,,10
90,2016,2,"Since being summoned to this world, my sisters and I have grown to miss our time in Valhalla.",How is my strategy?,Valhalla?,Yes! It is a spectacular palace that is also the sanctuary of all the Nordic Valkyries.,"Yep! If you want to experience blissful peace, you can visit my room tonight. I'm sure you'll enjoy your stay...",,,,,10
91,2041,1,"Are you interested in letting me build an artifact for you, that is unparalleled in the world?",Such a peaceful place must be blissful.,Is there a price?,"Well, it may take a long time to craft, maybe for two or three hundred years...","If you are unlucky, the artifact may bring curses. But don't worry, it won't kill you. At most, you will have nightmares for a few days...",,,,,10
92,2041,4,"To be honest, sometimes I always feel that the weapons I built have caused some unnecessary wars.",Maybe it is true.,I do not think so.,"But if there are no weapons, how can a kind person resist the invasion of evil?","Perhaps you are right. Weapons should be used to defend our homeland, not to invade and pillage the weak.",,,,,10
93,2041,2,"When you battle with enemies, which strategy do you prefer? Melee assault or long-range containment?",Melee assault.,Long-range containment,It is very similar to your brave and skillful character. Speed is precious in war. There is no more effective tactic than to quickly assault the enemies' weaknesses.,It surprised me. I never realized that your archery level is so high!,,,,,10
94,2041,2,"Every piece of equipment needs to be polished day after day, at least I will not tolerate any mistakes.",Are craftsmen all like this?,Seems to be very patient.,I can boast to say that there have never been any problems with the weapons I have made so far!,"Yes, a craftsman often needs to have the experience of building hundreds of equipment before he can become a master of a generation.",,,,,10
95,2024,2,Doomsday has always been the favorite stage of careerists and revolutionaries. Don't you think so?,Exactly.,Are you implying something?,I know you never let me down. There is no better opportunity to create a new order in doomsday.,"Well, You can't shield it from me. You already have ambitions to command all the gods, right?",,,,,10
96,2024,2,No one has ever understood the real reason...why I must be the ruler of the world.,Actually I can understand...,I would like to hear you talk about it.,"Really? Are you comforting me? But even if you just simply comfort me, I'm pretty happy...","Ah, after rule the world, even if I am a devil, I can stay with you justifiably every day, can't I?",,,,,10
97,2024,3,I can see that you are restless due to a hidden desire to me in the heart... isn't it?,No way!,"Well, you are right.","Really, my little one? So why is it me that is talking to you intimately here, not other girls?","Ah...what an honest guy, are you interested in coming to my room tonight and spending a long night with me?",,,,,10
98,2024,1,"The devil is just an identity. Whether it is an angel or devil, the one will always become a companion just as it should be.",Will you cooperate with angels?,That makes sense.,"Yes, I'm very interested in making friends with them, such as the guy named Michael...",It surprised me! I never thought you could really accept such extreme but wise advice!,,,,,10
99,2014,1,"Do you know? Dancing on the battlefield is not only an art, but also a good way to improve soldier morale!",Exactly.,I feel this is dangerous...,Hmm...your figure is also suitable for dancing! Are you interested in learning from me?,"Hum...Dance is not only performance. If it is combined with the use of weapons, it can become a very deadly offensive method!",,,,,10
100,2014,5,There are still a few hours until the next battle. It's so boring. How about tossing a coin?,Okay! I guess heads!,Hmm... I guess tails.,"You are lucky! Give this special coin to you as a souvenir! Don't despise it, you will have good luck with it!","Unfortunately, it came down heads. It seems that as the goddess of victory, even if tossing a coin, I will never lose!",,,,,10
101,2014,1,"As the goddess of victory, I am not the most powerful warrior, but the warriors can become powerful because of me.",This is an honor.,You are quite suitable to be an idol.,I will be proud of this. I look forward to supporting my companions as best as I can in future battles.,I... I actually had this idea a long time ago... I just...just too shy to tell others...,,,,,10
102,2019,2,"Anyone who dares to break the law will inevitably face eternal punishment, all in the name of justice!",There are imperfections in the law.,The law brings order.,"You're not wrong. But without law, the world would lose all sense of fairness and principle.","That pleases me. As the commander of the gods, you must understand the importance of law. An army needs order.",,,,,10
103,2019,2,Many people complain about their bad luck. It suggests that fate is inevitable.,Fate controls everything.,Fate can be changed.,The wicked will always stand trial for their evil acts. They can never escape the goddess of vengeance.,Humans are the most unbridled and conceited race I have ever seen. Perhaps this is what allows humans to change their fate.,,,,,10
104,2019,1,"Even though I am the goddess of vengeance, I hope that one day there will be no more sinners in the world.",I doubt that will ever happen.,I will try my best to help you.,"Justice has been difficult to reach since ancient times, but I will not shy away from trying. And because crime is an endless problem, my vengeance will also be endless.",I don't want to see you share my fate. Revenge and justice are heavy burdens. I would rather see you smile.,,,,,10
105,2001,4,"If there is a chance, do you want to have the ability to turn the opponent into a stone at a glance?",It's very effective against the enemy!,Uh... forget it.,"I want to get rid of this ability, because instead of improving combat power, I care more about not being able to face the person I like...","It seems that you already have a girl you like. If you have such skill, you can't look at her well.",,,,,10
106,2001,3,I like to read romance novels between different races. Will human beings mind the romance between different races?,At least I won't.,Maybe a little bit.,"Hmm...well...then the next question is, do you mind the love between humans and the Gorgon...",Ah... but this seems to make me even more yearning for this forbidden love...,,,,,10
107,2001,1,"What is popular among humans recently? If I also start to follow the trend, will humans accept me more?",I think they will!,You already have a strong personality!,"Are they? ! Then I want to know, what kind of fashion do young human girls like to wear at this time?",Ah... I'm embarrassed to hear that! It seems that inner and personality is the greatest charm...,,,,,10
108,2033,1,"Compared to daytime, I prefer to come out to relax and feel the tranquility of the world after night falls...",I quite like nightlife.,I'm still used to the daytime.,Are you interested in chatting with me tonight? Perhaps the wines from Crete can make us enjoy a wonderful evening.,"Human beings were born in the dark, but yearn for the light. This is really an interesting thing...",,,,,10
109,2033,2,"I used to feel helpless for losing my mighty divine power, but this is also the unpredictable nature of darkness.",This may also be destiny.,I am always with you.,"Yes, maybe destiny also hopes that I will not interfere too much in the disputes in this world...","Ahh.. no human beings have said this to me yet, but if you want, I am looking forward to spending time with you.",,,,,10
110,2021,1,"As the messenger of the gods and the incarnation of the rainbow, lightning speed is my most proud advantage.","Indeed, speed is precious in war..",I feel like you will hit something.,"Yes, you are right! Although my combat power is not the strongest, the most important thing in war is reconnaissance and communication!","It will never happen! If you don't believe me, I can fly with you and let you see it with your own eyes!",,,,,10
111,2021,3,I am working on magic that can turn painting into reality! What do you think?,I think it is difficult...,This is so cool!,"Next time I will draw a sketch of you! In this way, our combat power can be doubled!",Are you interested in learning? I can teach you! But I have to make sure that your drawing skills are not too bad...,,,,,10
112,2027,1,The Chinese lute is an elegant oriental musical instrument. It always makes people feel peaceful...,Can you teach me to play?,Do you want to play it?,"After this disaster is over, I will be happy to study the Chinese lute and music theory with you for the rest of the time.","The performance of musical instruments requires a tranquil heart and an elegant atmosphere. If you want to listen, come to my room at night...",,,,,10
113,2027,4,"War brings suffering, and even if the gods have eternal life, there will only be emptiness in the end.",I will end the war.,You should not feel lost.,"If it is you to lead the gods and quell the war, this day might come as soon as possible...","You are right. Depression will only bury hope and determination. Instead of sighing, it is better to fight this doomsday destiny.",,,,,10
114,2010,3,Hi! Are you interested in signing a new contract with the cute and charming succubus idol?,Didn't you just sign it yesterday?,I feel that there is a conspiracy...,"Well... As hell's number one idol and Lucifer's leading pioneer, Lilith's recent performance is not enough!","Stop being suspicious! If you are willing to sign, Lilith is happy to give you a solo show!",,,,,10
115,2010,3,Hi! Are you interested in signing a new contract with the cute and charming succubus idol?,Didn't you just sign it yesterday?,I feel that there is a conspiracy...,"Well... As hell's number one idol and Lucifer's leading pioneer, Lilith's recent performance is not enough!","Stop being suspicious! If you are willing to sign, Lilith is happy to give you a solo show!",,,,,10
116,2007,1,Do you like my bear? What do you think of animals like bears?,They are very brave!,They are so cute!,The power of nature is always worthy of trust and reliance. She can fight better than me on the battlefield!,"Well, on the battlefield, many enemies said the same before being stunned by her!",,,,,10
117,2007,1,Do you like my bear? What do you think of animals like bears?,They are very brave!,They are so cute!,The power of nature is always worthy of trust and reliance. She can fight better than me on the battlefield!,"Well, on the battlefield, many enemies said the same before being stunned by her!",,,,,10
118,1001,5,Will I be a hero who will save the world in the future?,Of course you will!,Well...emmm..,Hum...Look at this awakening power. Sooner or later I will become the leader recognized by my companions!,Why I feel that you have no confidence in me. Do you want me to give you a punch to prove it? !,,,,5:1000038:1,0
119,1001,5,Alas... Does the war between the gods for thousands of years make sense?,Of course there is.,It's boring...,It seems that there is no difference between gods and humans. Heroes will also fight to implement the correct ideas.,"I think so too. Instead of wasting time fighting every day, I'd rather sit down and have a cup of black tea and play poker games.",,,,5:1000038:1,0
120,1001,3,Well... if I'm the same as Bari... and wear a witch costume... how do you think of it?,It should be cute!,It should be very handsome!,"What are you talking about! Wait, where are you looking at? ! I'm going to be angry! !",I think so too! The witch costume is a symbol of justice and elegance!,,,,5:1000038:1,0
121,1001,1,Do you like playing baseball? Are you interested in competing with me?,Anytime!,You seem very confident.,"Humph! After solving the monster's troubles at the moment, I am looking forward to competing with you on the court!",At least you are definitely not as strong as me in hitting. The broken windows in the classroom are all my masterpieces of home runs!,,,,5:1000038:1,0
122,1001,2,"In the face of powerful monsters, sometimes I have to use bows and arrows to fight... How can I shoot more accurately?",Lose extra fat?,Wear a good pair of glasses?,You... why are you staring at my breasts? ! That does not affect my bow!,Humph! My eyes are not bad at all. It is not a problem to throw an apple with a knife within ten meters!,,,,5:1000038:1,0
123,1001,3,I miss the days when I played a game of beach volleyball happily in the hot summer.,Looking forward to your match!,Looking forward to your swimsuit!,Haha! Youth are valuable on the field and on the beach!,"What you said is really direct... Well, though I am confident about my figure...",,,,5:1000038:1,0
124,2034,2,"Death is not an end, but a new beginning... What do you think?",Maybe...,I do not think so.,There is no need to doubt that everyone who has left the world will always meet again in another way.,"Haha...When you leave this world, maybe you will understand...",,,,,10
125,2034,2,"If you can choose, what do you want, eternal life or a happy life?",Eternal life...,Happy life!,"This was also my choice, but after witnessing countless farewells, all I have left is loneliness...","That is quite an interesting answer. As human beings, life is like fireworks-short but brilliant.",,,,,10
126,2013,2,What do you think of the heavy fate carried by the heroes?,Gladly accepted.,Strive hard.,"Oh, it feels like you and I are so similar. Maybe you also have a little string in my fate?",Huh... It's fun to watch human beings struggle helplessly in front of an unchangeable destiny...,,,,,10
127,2013,5,Hum... Guess what your luck is today?,Good luck? !,Bad luck...?,"Heehee... Staying with me, a girl in charge of bad luck, can at least protect you from bad luck.","Heehee...If you don't throw away the banana skin after eating the banana, you should be able to dodge a bullet...",,,,,10
128,2013,5,"Is there a girl you like? Would you like me, a genius prophet, to help you predict your relationship with her?",Yes!,Not yet...,Let me see who you like...Wow! You are such a bold person!,"Ah, destiny tells me that you will like a cute girl with cat ears and she likes sleeping late...",,,,,10
129,2013,2,Well... I'm used to the fate of being treated with cold eyes because of constantly predicting disasters.,Do you need a hug?,Heroes are always alone.,"I am not so feeble! But... But if you want to comfort me, I'll make a change to let you hug me!","Wow... it's rare that you can say such artistic words, it surprised me...",,,,,10
130,2011,3,Awww... The weather is nice today. Are you interested in basking with me?,I'd love to!,I...not very used to it.,"I know a good place to bask in the sun! But I have to ask first, are you... scared of heights?",Get used to it a few more times! Don't you want to have healthy tan skin?,,,,,10
131,2011,3,Eh...? I feel a hot gaze on me...,"Oops, I'm sorry...",You are indeed very attractive.,"Come on, don't be so shy... Appreciating the beautiful figure of Egyptian girls is a kind of enjoyment!","Really? ! Nuit thinks so too! In return, give you a kiss! Chu!",,,,,10
132,2011,1,"The dry desert occasionally has a downpour, which is really refreshing!",Exactly.,Holding an umbrella is a bit troublesome...,My desert also longs for a gentle rain tonight...so...are you free tonight?,Umbrellas are too boring! Don't you think that a girl soaked in the rain is a kind of beauty?,,,,,10
133,2026,2,The beauty of art lies in who appreciates it. Don't you think so?,I totally understand.,I don't know much about art.,It's easy to get thousands of money but hard to find a truly friend. Maybe my art exists for you...,"If you are willing to stay with me forever, you will understand sooner or later...",,,,,10
134,2026,2,This world is the most beautiful artwork. May it not be destroyed by war...,War is also an art,Hope as you wish.,"Perhaps it is, the good and bad are ever-changing. Without the cruelty of war, how can the peace come...","After this disaster is over, I will go around the world with you to restore this artwork.",,,,,10
135,2026,2,The universe is unconscious; it regards everyone as insignificant. Do you agree with ​​this sentence?,I think so.,I do not think so.,"Sometimes I sigh for the mercilessness of heaven and earth, but this is also the rule of nature and it is hard to break...","Although I don't want to say that, kindness without power may just be weakness.",,,,,10
136,2026,2,What do you think of my music... and my character?,"Elegance, tranquility...",Overflowing with enthusiasm!,It seems that we are heart to heart. I always hope that I can be as gentle as the earth.,It seems that you can see the enthusiasm for art in my heart. Few people understand me like this.,,,,,10
137,2038,1,Are you interested in archery?,I am good at it!,It seems very difficult...,"Are you? As the best archery of the Yamato god pedigree, it becomes more worthy to compete with you!","After mastering the skills, it is very simple. If you are interested, I can teach you personally!",,,,,10
138,2038,5,Your age is really mysterious! I just saw someone talking in a box in a street shop!,You mean...TV?,Uh...then?,Is that thing called TV? What kind of magic can lock people in boxes...,"I thought it was a monster, so I shot it with one arrow... Why did you look at me and laugh! Did I do something stupid?",,,,,10
139,2038,3,Are you free tonight? Are you interested in watching a fireworks display with me together?,Of course I am free!,I'm a bit busy recently...,"That's really exciting! See you tonight! By the way, do you want me to prepare a yukata for you? !",Humph... Are you going to date other girls? Your face is very red...,,,,,10
140,2038,1,"Come on! I found something fun! Just press this button, it can record the scenery in front of you!",Isn't this a camera?,(Push the button),"Ah! So this thing is called a camera... In terms of painting and recording, this thing is much useful than the magic!",Why are you suddenly facing me... It's too sudden! Wait wait wait! I need to change into a more beautiful kimono!,,,,,10
141,2022,2,"Everyone is eager to predict their own destiny, but do they have the courage to face the cruelty of fate?",At least I have the courage.,I do not know either...,"Really? But it's a pity that you are not an ordinary mortal or an ordinary god, even I can't predict your future.","In fact, whether you are a mortal or a god, knowing your own destiny is not necessarily a good thing.",,,,,10
142,2022,2,"As the goddess of fate, I cannot remember my past, nor can I know who I am...",You may come from Norse...,You may be from Greece...,"Are you referring to the three sisters of Nornir in Norse? Possibly, I feel that there are fragments of their souls in my body...",The three sisters of Moirai in Greece? Maybe...I feel that sometimes they appear in dreams...,,,,,10
143,2008,2,Do you like drinking tea? I miss the peaceful afternoon tea time every day before the end of the world...,Yes I like!,I don't like it very much...,"After this disaster is over, I really hope to have the opportunity to enjoy the afternoon tea and snacks with you...",It seems that you might be more suitable for this adventurous age when there are wars than a peaceful period...,,,,,10
