id,boss_name,avatar_path,spine_name,boss_descirbe,role,quality,star,job,level,skill_id_list,fight_value,max_hp,min_attack,max_attack,defend,defend_ignore_level,physc_def,magic_def,hit,dehit,crit,decrit,damage_add,damage_minus,crit_damage_add,drain_hp,defend_ignore,physc_def_ignore,magic_def_ignore,debuff_resist,hp_recover,bounce_rate,speed
1,Celebration·Cupid,2047_UR_PLUS.png,QBT_UR_PLUS,M.DMG is recommended as enemies have high P.RES and Debuff Res,16,9,5,2,400,124601001|124602001,333333333,3600000000,9000000,10000000,1000,0,1000000,0,500000,0,0,1,0,0,0,0,0,0,0,99999,0,0,0
2,Celebration·Hera,2039_UR_PLUS.png,HL_UR_PLUS,P.DMG is recommended as enemies have high M.RES and Debuff RES!,16,9,5,3,400,153801001|123801001|123802001,111111111,8000000000,9000000,10000000,1000,0,0,1000000,500000,0,0,1,0,0,0,0,0,0,0,99999,0,0,0
3,庆典·冰霜龙母,2055_UR_PLUS.png,LB_UR_PLUS,Enemies have strong control skill and high Debuff RES. Angels with Debuff RES skill is recommended.,16,9,5,3,400,125401001|125402001|155401001,222222222,2500000000,9000000,10000000,1000,0,0,0,500000,0,0,1,0,0,0,0,0,0,0,99999,0,0,0
4,Celebration· Chang'e,2067_UR_PLUS.png,CE_UR_PLUS,The enemy has strong finishing moves and status resistance. Deploy Angels with DMG Reduction and taunt abilities!,16,9,5,2,400,126601001|126602001|156601001|156602001|156601001|156602001,444444444,5200000000,100000000,120000000,1000,0,0,0,500000,0,0,1,0,0,0,0,0,0,0,99999,0,0,0
5,庆典·灰烬龙女,2056_UR_PLUS.png,LH_UR_PLUS,The enemy has high AoE damage. Deploy Angels with healing abilities!,16,9,5,1,400,125501001|125502001,555555555,4800000000,100000000,120000000,1000,0,0,0,500000,0,0,1,0,0,0,0,0,0,0,500,0,0,0
6,Celebration·Asura,2068_UR_PLUS.png,AXL_UR_PLUS,True DMG is recommended as enemies have high DEF and Debuff Res!,16,9,5,1,400,126702001,777777777,3500000000,900000,1000000,100000,0,0,0,500000,0,0,1,0,0,0,0,0,0,0,99999,0,0,0
7,Celebration· Himiko,2053_UR_PLUS.png,BMH_UR_PLUS,The enemy has high ATK and lifesteal. Deploy Angels with control abilities!,16,9,5,1,400,125201001|125202001,666666666,6000000000,100000000,120000000,1000,0,0,0,500000,0,0,1,0,500,0,3000,0,0,0,0,0,0,0
