idx,cid,state,girl_dialog,switch_1,switch_2,girl_dialog_after_switch1,girl_dialog_after_switch2,sound,sound_after_switch1,sound_after_switch2,award,favorability
1,2047,2,Humans suffer so much frustration and betrayal in romance. I wonder if they still believe in love.,At least I believe!,I do not know either...,Good answer! Doesn't love appear precious because of many hardships?,"Your tone makes you sound bitter and jaded. There's no need for that. With me at your side, your luck with love will be much better.",,,,,10
2,2047,2,Do you have a crush on a special someone? Would you like for me to use one of my arrows to make her fall in love with you?,I totally agree!,I disagree.,"Right? After all, if gods are so different from humans that they can't share a deep love with them, I would rather not be a god!","... After all, humans have short lifespans. And, sadly, their love dies with them.",,,,,10
3,2047,1,Do you have a crush on a special someone? Would you like for me to use one of my arrows to make her fall in love with you?,I'm too embarrassed to say!,"Yes, I do!","If you don't tell me who it is, then I'll write your name on an arrow and shoot it out blindly! Do you really want to leave it up to chance?",So which lucky girl will my arrow of love strike? Wait... This arrow seems to be targeting me?!,,,,,10
4,2047,2,Humans always think that power and money can buy them anything. But that's not the case with love.,You are right!,How do you know when you've found true love?,I make it my mission to ruin love rooted in greed. Will you stay at my side and help?,"You know its true love when you're willing to give up everything for it, including the power to rule the world.",,,,,10
5,2047,1,Are you good at archery?,I'm very good at that!,Uh...not very good.,Really? That's great! I'm a bit tired of being the god of love and need a break. I'm looking for someone to take my place for a while,"Do you want me to give you private lessons? Just grab my hand and draw back the bowstring. ...Oh, why is your other hand touching me there?",,,,,10
6,2047,2,Being a god of love is also quite boring. I also want to have an unforgettable date!,Are you free tonight?,Who do you want to date?,I wasn't expecting you to ask me so suddenly! I don't know what to say...,"Anyone would be fine... Although, a date with you would be nice.",,,,,10
7,2039,1,I like lilies very much. It can symbolize purity and loyalty more than ever in the world.,It really suits you.,I like it too.,"That's just the way it is! No matter how pleasant your words are, I won't be happy with the praise from mortals!","You are different from those who love flowers with beautiful colors, which surprised me a lot..",,,,,10
8,2039,5,"According to prophecy, I will marry a very powerful person who lusts after women.",Fate can be changed.,You can't deny fate.,It seems that you are a person who does not believe in fate. It has been a long time since no mortal dared to fight against fate.,"For your sake, you better hope that person isn't you. Whoever I marry will suffer horribly.",,,,,10
9,2039,3,"Want to visit my private garden? Even if the end of the world comes, I have a quiet place of my own.",I feel very honored!,Will it bother you?,There's no one else here. Just relax and enjoy this time alone together.,"Although there are only two of us! But this is just a personal invitation, don't think too much!",,,,,10
10,2039,1,The flames of war give my flowers an especially attractive glow.,I hope you are merciful.,I wish you good luck and prosperity.,"I'm never soft on the battlefield. But if you want me to treat the enemy with kindness, I won't object.",Haha... Many people have already said this to me and followed me onto the battlefield. Would you like to know their stories?,,,,,10
11,2039,4,"Since I lost my divine power and memory, it seems that the whole world doesn't care about me anymore.",At least I care.,The world is always cruel.,What are you talking about! I don't... don't care if a mortal admires me!,"Haha...Yes, what this world prizes power. Would you help me regain some of my power by serving as my sword and shield?",,,,,10
12,2039,5,Mortals are pitifully weak. Yet history has proven their resilience time and time again.,I am also a mortal.,Unity is strength.,You are different from everyone else! You are the only one I have ever admired. That is why I have chosen you and only you.,"The gods are always fighting amongst themselves. Yet, I'm astounded that you have managed to unite even opposing gods under one banner.",,,,,10
13,2049,4,I still have a fear of flying. Maybe I should give up using these wings?,You need to face your fears.,Giving up is not a bad thing.,You're right. I will continue trying to overcome my fear.,Whether or not I can fly doesn't matter. Seeing you gives me courage.,,,,,10
14,2049,5,"According to some, ignorant people are often fearless. Do you agree that bravery is rooted in ignorance?",There may be some truth to that.,"If so, such bravery seems reckless.","I think so, too. When heroes know they might fall in battle, it can fill them with fear.","Yes, sometimes that is true. But such recklessness comes at a heavy cost.",,,,,10
15,2049,1,"Truth is deceptively alluring. Though we know we will never understand it, we still pursue it with voracious curiosity.",Wisdom can only be found in truth.,It's not bad to be naive.,"Unfortunately, my bravery precludes such wisdom, for I rarely think things through. I am often blinded by my confidence.","Some things grow more confusing the more you think about them. Regardless, it is still good to ponder such things.",,,,,10
16,2049,3,Wonderful art is like an clever invention. Both are products of great imagination and creativity. Don't you agree?,Exactly.,Can you give an example?,"Therefore, a good artist should also be a good inventor. I always dream to be such a person!",My artificial wings are a spectacularly beautiful invention! Aren't they the perfect example of artistic invention?,,,,,10
17,2049,2,"Sculpture is a passion of mine. No matter my mood, it always calms me down.",I want to see your works!,Can you teach me that?,"My sculptures are a private affair since they are all body art based on myself. But for you, I'll make an exception.","Sculpture is best learned on your own, though I would be happy to be your model!",,,,,10
18,2049,5,I still can't figure out what distinguishes gods from the rest of creation...,The level of ability?,Their longevity?,Not necessarily. I have seen many human heroes in Greece. They are fully strong enough to compete with gods on the battlefield!,"There are many monsters and demons whose lifespans are nearly eternal, but they don't seem to be gods either.",,,,,10
19,2055,2,Do you like snowy winters?,"Yes, I love it!",It's too cold!,I'm pleased that you enjoy that season. The cold often brings an icy calm to the land.,"People often associate cold with death. However, snow and ice are part of the world, and they are eternal.",,,,,10
20,2055,2,"I used to spend a long time in my lair, and no one can understand that feeling of loneliness...","Actually, I can.",You are no longer alone.,"Many great human heroes have faced like this. They are surrounded by countless glory, but they are never understood by others.","I never thought I would be interested in a human being, but the days with you seem to be quite interesting.",,,,,10
21,2055,2,"I don't agree with war, because war will always bring endless disasters to this world...",I don't agree either.,There is always a reason for war.,"Fortunately you think so. What the world needs is rationality and order, not chaos and destruction.",But most of the reasons are unreasonable. I hope you can calmly think about the meaning of every battle like me.,,,,,10
22,2055,1,Want to know my sisters of the same race? They seem to have awakened in this disaster.,You mean the Ember Dragon?,You mean the Storm Dragon?,"She is the worst-tempered of our three sisters. She is very anxious but enthusiastic and refreshing, and she has a good relationship with humans.","She has the brightest mind of our three sisters. There have been many bounty hunters to fight against her, but none of them have come back...",,,,,10
23,2055,5,Humans are eager for eternal life like gods. This is actually not difficult to do. Do you want to try it?,I want to give it a try!,Uh... forget it.,"The method is very simple. Freeze yourself, then you can have eternal youth like me. Isn't this wonderful?","Wise decision. Mankind may be able to obtain eternal life, but it may pay a greater price for it...",,,,,10
24,2055,2,Most humans think that I am just a cold and merciless god. Do you think so too?,I don't think so.,Have a guess.,Strange guy... Maybe this is why I am willing to open my heart in front of you...,"I don't know...but so far, no one will accompany me like you all the time...",,,,,10
25,2050,3,You seem to be available. Would you like to spend a long night with this lonely lady?,Do you mean a date?,"Uh, I'm afraid I have other things to do.","Oh! So direct! ...But yes, it would be a date. I hope to share a lovely evening with you. We could make many pleasant memories.",Hmm... let me guess... You already have plans with another girl?,,,,,10
26,2050,3,Is it really that important for someone to tell the truth?,Of course!,I don't like to be lied to.,"Since I created the world, I haven't seen many humans tell the truth. It's a pity.",Oh really? So... I love you. But is that the truth or a lie? Take a guess.,,,,,10
27,2050,1,Do you prefer day or night?,Day.,Night.,"I envy humans for the time they spend in the afternoon sun, whether it be shopping, sunbathing, or strolling through the park with a lover.",The night is full of mystery. It is the perfect time for two lovers to be alone... Anyway... Are you free tonight?,,,,,10
28,2050,1,"In my opinion, humans worry too much about good and evil when deciding how to act. What really matters their intention and conviction.",I think kindness is most important.,Conviction demonstrates strength!,"Oh, really? Then we'll see if your kindness can save us from the disaster that's engulfed the world.",That's pleasing to hear. I prefer strong individuals.,,,,,10
29,2050,1,"When faced with a difficult decision, do you rely more on intuition or rational analysis?",I rely more on intuition.,I follow reason more.,"If you follow your instincts, what sort of trouble will the two of us get into tonight when we're alone in our room?","You may be calm and rational now, but we'll see how long that lasts in the presence of my seductive charm.",,,,,10
30,2050,2,"Movies are one of the most wonderful inventions of human civilization. Do you love watching movies? Which do you prefer, comedy or tragedy?",I prefer comedy.,I prefer tragedy.,"Not surprising. The world is already full of tragedy. ...And speaking of tragedies, I hope you can stop the disaster that's engulfing the world today.",I'm shocked! Just don't watch too many of them. I don't want them to make you pessimistic.,,,,,10
31,2062,3,"The moonlight is pretty tonight, isn't it?",(Smile and nod),(Silence),"From now on I will miss the moon that we saw today, and I hope you will not forget today's promise...",You don't need to answer me so quickly. I will wait until you complete your mission.,,,,,10
32,2062,2,"I am not afraid of this war, I hope to end it with you.",As you wish.,I will face it alone.,"Thank you for your trust in me all the time, and I will protect your back on the deadly battlefield.",Then at least allow me to pray to the moon for your safety every night before the war is over.,,,,,10
33,2062,1,"I like gentle animals like rabbits very much, how about you?","Me, too.",Just so so...,They like to get close to humans very much. They are so lovable guys...,"Hmm... With your personality, you might prefer some fierce and wild guys, right?",,,,,10
34,2062,4,"If one day, I have to go back to the moon, would you like to go with me?","Yes, I'd love to.",I'm afraid not……,"After this war is over, let's go back to my hometown together, where there will never be apocalypse and disaster.","I understand that you are in this world, maybe there are things you can never give up...",,,,,10
35,2062,5,"I actually don't want to be a god, because eternal life is too heavy for me...",But it is fate.,Mortals also have troubles.,I should be grateful for meeting you. Maybe this is the greatest comfort that fate has given a lonely person.,Mortal people sigh for the short life. How can they understand the eternal loneliness...,,,,,10
36,2062,1,"It's a boring and deserted night. When I was lonely in the past, I would always sing a nursery rhyme to relieve boredom.",I want to hear you sing.,Do you want me to sing it to you?,"Then lie down on my lap, close your eyes and listen quietly. Wish you a good night...","Well, if it were you, I would be happy to listen.",,,,,10
37,2051,2,What do the battlefield horns inspire?,Courage!,Anger?,"Well, next time show me your bravery on the battlefield.",Only those who have had their homeland invaded would understand.,,,,,10
38,2051,2,"As long as I can fight, the enemy will never set foot inside the city gate.",I will be with you.,I believe in your power.,You are very reassuring.,"So far, I have never let my Nordic companions down.",,,,,10
39,2051,2,There is always someone we want to protect. This is true for everyone.,Who do you want to protect?,Exactly.,"I refuse to answer, but... you will know in the future…","Then, what about you? Who do you want to protect?",,,,,10
40,2051,2,Have you heard of Ragnarok?,Yes.,Not really.,I swear... Never let this happen again in this world.,"Well, that's ok, you don't want to know how tragic the disaster was...",,,,,10
41,2051,4,You almost died in the previous battle! How can you be so reckless!,Sorry to have worried you.,The brave always have good luck.,I wasn't worried. I was just... pointing it out.,"If you don't have my protection next time, then don't take risks like that again!",,,,,10
42,2051,2,I'm afraid it will be difficult to recover the divine power I lost...,Don't give up.,I will guard you.,What do you mean... Are you willing to regain my strength with me?,You fool...,,,,,10
43,2053,2,"You are too young to be a ruler! If I were you, I'd be desperate to gain experience and mature as quickly as possible.",I will do my best!,Success should not be rush!,You remind me of my youth. It was nice to reminisce on ages past.,I'm glad you're not short-tempered like me. Maybe you're a more suitable commander than I am.,,,,,10
44,2053,2,I see little distinction between gods and mortals. Gods are just more powerful versions of humans.,I agree with you.,"But gods are immortal, and humans are not.","Therefore, as long as human beings continuously hone themselves, one day they will be able to reach the mighty state of gods!","When it comes to eternal life, humans can achieve it either through prayer or magic. Just look at me! I'm the perfect example.",,,,,10
45,2053,2,"War is glorious in its own way. I am not afraid of war at all, nor do I deny its importance.",But war brings death.,I am also not afraid!,"It is worth dying on the battlefield for your own ideas and values. After all, isn't the greatest joy in life to think and act as one pleases?","I hope you can also find the meaning and value of your life on the battlefield, and fight for your own ideas!",,,,,10
46,2053,1,"Do you think it is weird for a miko, or shrine maiden, to wear a samurai costume?",Not at all!,It's kind of strange...,"It's not weird to me either. It's the meaning behind it that's important. A miko must not only be wise and reverent, but she must also have the will of a samurai!",You won't think it strange when I prove to you on the battlefield that I am also a qualified warrior with an indomitable will!,,,,,10
47,2053,2,"Ever since I was reincarnated in this world, I have spent each day thinking about eventually restoring the country of Yamatai.",I will always support you!,Do not tangle in the past.,I knew I could trust you! I look forward to seeing your talent and courage as a ruler!,"If anyone else said this, I would never agree. I don't know why, but I always think you're right.",,,,,10
48,2053,3,Do you think I am too serious for a woman? Does it make me less feminine?,Not at all!,Do you care?,"Good, because even the most feminine woman can have a strong and commanding side to her personality!","When I'm with you, I worry about it more than I should admit.",,,,,10
49,2057,2,"The more powerful the force, the more dangerous it is, and so is the storm...",I will stay away from the storm.,I will control the storm.,"Unlike most humans, you are more rational than I thought, and maybe it is a correct decision to cooperate with you.",Really? You are the 147th human to say this. Guess the fate of the last 146 guys?,,,,,10
50,2057,2,"Only wisdom can control powerful forces, not anger. How do you think of it?",You are right.,I do not think so……,"I am very pleased to hear that you agree with my point of view, maybe you really have the ability to become the leader of the gods.","Anger will only make your head hot, but if you can control your own anger, you may also have powerful power.",,,,,10
51,2057,2,"The war is simply boring. With the time for fighting and killing, it is better to study others.",War also brings progress.,I agree with your philosophy.,"In a way, you are right. After defeating the group of idiots who came to crusade against me, my strength has indeed improved a lot.",So how long will it take you to end this world war between the gods?,,,,,10
52,2057,1,Two sisters of my family seem to have awakened with this disaster...Although it was also in my expectation...,You mean the Ember Dragon?,You mean Frost Dragon?,"It's not a good thing for this grumpy guy to wake up. Surprisingly, she gets along well with humans...","If you're fine, don't mess with her. If she is in a bad mood, you may be frozen in ice for the rest of your life...",,,,,10
53,2057,2,Why do humans and gods like to entangle their identities so much... Gods and humans are indistinguishable from me.,Why do you say that?,I think so.,"God also has birth and destruction, and he also needs to follow the rules of the world. God is not the truth, but just a strong existence.","In my opinion, only those who want to become gods would say this. It seems that you are also an ambitious guy...",,,,,10
54,2057,3,"Although I regard you as a competitor, I have to admit that I have a good impression of you...",me too!,I was surprised!,"In addition to competitors. I am looking forward to the relationship with you in the future, that... a deeper relationship can also be...","You are too slow! We have been working together for so long, haven't you noticed it...",,,,,10
55,2056,1,Ah...it's so boring! ! I really want to find a strong one to fight! !,I will be your opponent?,Are you in the next battle?,"no problem! This time I won't be like the last time, because I lost to you carelessly!",Is it finally my turn to play? ! Wait to see me burn the enemy into a barbecue! Hahaha!,,,,,10
56,2056,3,"Are you asking about what I would do when I met an enemy? Of course, first persuade him to surrender! Roast him without surrendering!",It was unexpectedly scary...,It's unexpectedly reasonable.,Do I look like a merciful person? ! Nothing excites me more than defeating an enemy!,"Even if it is a monster, it must be given a chance to solve the problem peacefully, although it is useless most of the time.",,,,,10
57,2056,5,"War is no different from a game. It's just who gets out first, what do you think?",As you said.,I disagree.,"As your companion, I am very happy to hear you, the commander-in-chief, agree with me, hum...","It's no surprise that when I stepped onto the battlefield of this world, I had no longer any nostalgia for life.",,,,,10
58,2056,1,"Hmm... I noticed that the two sisters, just like me, have also awakened in this world...",You mean the Storm Dragon?,You mean Frost Dragon?,"She is a wise and strategic guy, but if you really want to fight, she will definitely not be able to beat me!","That cold guy is so boring, I can't stay by her side for a second!",,,,,10
59,2056,5,"The reason why God owns the place not because he is powerful, but he has extraordinary courage and determination to die on the battlefield!",You are right!,What you think is too simple.,"Therefore, as the commander of the gods, you must have courage stronger than them!","Thinking too complicated is meaningless. Without courage, how do you face the difficulties and fears on the way to becoming a god?",,,,,10
60,2056,1,Human cooking is really interesting. I have begun to understand the meaning of the phrase civilization begins with flames.,Can you cook too?,Which dishes do you like?,Didn't expect it? ! My craftsmanship is not inferior to your top human chefs!,"Hmm... let me think... I like most of the dishes, but of course, the roast meats are my favorite! !",,,,,10
61,2032,2,"It seems that even if I spared no effort, it is still difficult to make the sun of this world shine again...",There is no need to blame yourself.,We will encounter it together.,"Indeed. Self-blame has no significance. As a symbol of light and hope, I need to cheer up again!","You are right...Even if you were once the ruler of the sun, you still need to face the end of the world with your companions.",,,,,10
62,2032,2,"I often recalled the days when I was in Takamagahara. Although there were constant troubles, they enriched my life.",People need to face the future.,Memories bring determination.,"Sorry, I seem to be over-indulged in the passing time. I hope it didn't bother you.","As you said, people expect to find a peaceful life like in the past, so we must end this disaster!",,,,,10
63,2032,2,Why do people have to use war to solve problems and contradictions? Doesn't this make the matter worse?,You are right.,"But in fact, it's not.","Anyway, I always believe that differences in ideas can be unified in a more peaceful way, not war.","I can understand the dilemma that needs to be resolved immediately in a crisis, but I still hope that you treat every war with caution.",,,,,10
64,2032,2,"After going through this disaster, I must revive the former glory of Yamato god pedigree and bring peace to the gods!",This is very exciting.,That sounds like a heavy burden.,"At that time, the Yamato gods will take the responsibility of maintaining peace, so the re will be no disputes anymore.",But I will definitely complete this mission. Do you feel it? That's why destiny made me come to this world.,,,,,10
65,2032,5,Your clothes were damaged badly in the battle... Do you want me to make you a new one?,Thank you.,That's somewhat embarrassing...,"Although I live in a different era from you, I am very confident in my skills in spinning and designing clothes!","Although when I measure your height and measurements, you need to be frank with me, I think our relationship should be fine for that...",,,,,10
66,2048,2,"Mortal people always fear death. In my opinion, death means tranquility free from emotion and eternal beauty...",I do not agree.,I agree.,"Haha, when a person feels no fear of death, he will no longer have any weaknesses. You will soon understand...",You are the most rational mortal I have ever met. Our future cooperation may become more interesting...,,,,,10
67,2048,2,"Whoever it is, it is god or mortal, everyone needs to face the fate of destruction and vanishing...",Exactly.,The strong will challenge fate.,"Therefore, no matter it is mortal or gods, they should follow fate while they are alive and prepare for death...","Oh, really? I would like to see if you, as the spokesperson of death, can escape from me...",,,,,10
68,2048,5,Why do people always call my strategy a conspiracy? Is there any difference between good and evil in fighting strategies?,I think there is no difference.,I think there is a difference.,"A wise answer. A strategy is just a strategy, to differ them as good or evil is just a kind of rhetoric and excuse.",It seems that you are different from me. You are more willing to use your fists and strength to resolve conflicts... Should I praise your sense of glory?,,,,,10
69,2048,2,I never deny that I am a careerist. This messy world is so in need of order and unity!,Order comes from the strong!,Order comes from rules.,"You are right, but unfortunately, this sentence is only valid when the strong man is alive...","Oh, it's hard to believe that I would hear this from mortals. That's right, you will find that death is the fairest rule in the world.",,,,,10
70,2048,2,Is glory such an important thing to a soldier?,At least I think it is.,It is not important.,Yes...see how many heroes lost their lives for glory. Death in this way is also an art...,"Death will erase everything. Whatever how great the glory was made by the hero, it will fade away with the passing of admirers...",,,,,10
71,2031,2,Death is not horrible. What's terrible is that you have regrets for your life when you die.,Life is not perfect.,I have no regrets at all!,Look at your reaction...do you think that the biggest regret in life is the lack of a girl's company?,"Well, look at the girls around you, see how they admire you. You really have no regrets in your life.",,,,,10
72,2031,1,"Monsters are rampant in the underworld recently, which is very bad. Do you have time to solve the trouble with me together?",I bet it's a mission with no return.,No problem!,"With your strong power, you will return from any dangerous place. Of course, it is another matter of which way you come back, whether it is standing or lying down...","Hmm... you'd better put on the thickest armor before you leave, otherwise I don't guarantee that you will come back completely...",,,,,10
